{
  "runtime": "codex-runtime-pipeline",
  "runtime_provenance": {
    "think_tank_runtime_used": true,
    "provider_policy_checked": false,
    "dispatch_decision_emitted": true,
    "provider_invoked": true,
    "result_recovered": true,
    "true_multi_agent_runtime": false,
    "execution_method": "adapter_runtime",
    "data_collection": "provider_managed",
    "evidence_state": "verified_partial",
    "result_recovery": "automatic",
    "boundaries": [
      "Codex runtime pipeline fixture uses adapter runtime.",
      "No true independent multi-agent runtime is claimed."
    ]
  },
  "mode": "research",
  "runtime_plan": {
    "mode": "research",
    "selected_profiles": ["source-collector", "trend-analyst", "skeptic", "report-architect"],
    "priority": "high",
    "complexity": "high",
    "strict": false,
    "fallback_behavior": "use_default_mode",
    "stages": [
      {
        "name": "collection",
        "max_rounds": 1,
        "load_mode": "standard",
        "required_capabilities": ["source-acquisition"],
        "optional_capabilities": ["browser-automation", "knowledge-persistence"],
        "expected_output": ["sources[]", "evidence[]", "boundaries[]"],
        "failure_behavior": "degrade_or_stop_for_missing_required"
      }
    ],
    "boundaries": []
  },
  "slot_resolution": {
    "resolutions": [
      {
        "capability": "source-acquisition",
        "required": true,
        "candidate_implementations": ["local_static_reader", "user_provided_material"],
        "selected_implementation": "local_static_reader",
        "availability": "available",
        "invocation_status": "skipped",
        "capability_status": "verified_partial",
        "boundary": "Implementation is available but runtime invocation must still be verified."
      }
    ],
    "missing_required": [],
    "can_continue": true,
    "boundaries": ["Implementation is available but runtime invocation must still be verified."]
  },
  "run_state": {
    "run_id": "run-fixture",
    "protocol_version": "0.2",
    "mode": "research",
    "status": "pending",
    "current_stage": "intake",
    "current_round": 0,
    "selected_profiles": ["source-collector", "trend-analyst", "skeptic", "report-architect"],
    "selected_capabilities": ["source-acquisition", "browser-automation", "knowledge-persistence"],
    "completed_stages": [],
    "pending_stages": ["collection", "analysis", "synthesis"],
    "boundaries": [],
    "created_at": "2026-05-14T00:00:00+00:00",
    "started_at": null,
    "completed_at": null
  },
  "source_result": {
    "runtime": "codex-minimal",
    "runtime_provenance": {
      "think_tank_runtime_used": true,
      "provider_policy_checked": false,
      "dispatch_decision_emitted": true,
      "provider_invoked": true,
      "result_recovered": true,
      "true_multi_agent_runtime": false,
      "execution_method": "adapter_runtime",
      "data_collection": "local_files",
      "evidence_state": "recovered",
      "result_recovery": "automatic",
      "boundaries": [
        "Minimal source-acquisition fixture only.",
        "No full multi-agent runtime is claimed."
      ]
    },
    "mode": "research",
    "profile": "source-collector",
    "capability": "source-acquisition",
    "dispatch_request": {
      "target": "think-tank/examples/browser-automation-fixture.html",
      "constraints": ["readonly", "no_login", "no_download"]
    },
    "dispatch_decision": {
      "selected_skill": "local_static_reader",
      "status": "dispatched",
      "risk_level": "low"
    },
    "invocation": {
      "invoked": true,
      "method": "local_static_reader",
      "target": "think-tank/examples/browser-automation-fixture.html",
      "result_status": "success"
    },
    "recovery": {
      "result_recovered": true,
      "recovered_as": ["sources[]", "evidence[]"]
    },
    "sources": [
      {
        "title": "think-tank browser automation fixture",
        "url": "think-tank/examples/browser-automation-fixture.html",
        "source_type": "static-html",
        "summary": "Local static fixture used for runtime pipeline validation.",
        "reliability": "medium",
        "freshness": "2026-05-14T00:00:00+00:00",
        "extracted_at": "2026-05-14T00:00:00+00:00"
      }
    ],
    "evidence": ["local_static_reader returned readable static content."],
    "boundaries": ["No fallback, browser DOM, login state, or private write was attempted."],
    "quality_check": {
      "protocol_complete": true,
      "evidence_boundary_clear": true,
      "actionable": true
    }
  },
  "consensus_result": {
    "level": "L1",
    "agreement_rate": 1.0,
    "votes": {"agree": 2, "abstain": 0, "disagree": 0},
    "blocking_objections": [],
    "should_continue": false,
    "stop_reason": "L1_consensus",
    "minority_opinions": []
  },
  "final_output": {
    "conclusion": "Codex runtime pipeline completed with recovered source.",
    "evidence": ["local_static_reader returned readable static content."],
    "recommendations": ["Use recovered sources for analysis"]
  },
  "quality_check": {
    "protocol_complete": true,
    "evidence_boundary_clear": true,
    "actionable": true
  },
  "boundaries": [
    "Implementation is available but runtime invocation must still be verified.",
    "No fallback, browser DOM, login state, or private write was attempted."
  ]
}
